{
  "$schema": "http://json-schema.org/draft-07/schema#",
  "title": "AxonClawX Template Schema",
  "type": "object",
  "required": ["id", "version", "type", "metadata", "content"],
  "properties": {
    "id": {
      "type": "string",
      "pattern": "^[a-z0-9-]+$",
      "description": "Unique template identifier"
    },
    "version": {
      "type": "string",
      "pattern": "^\\d+\\.\\d+\\.\\d+$",
      "description": "Semantic version"
    },
    "type": {
      "enum": ["scenario", "multi-agent", "agent", "automation", "diagnostic", "recipe", "tip", "snippet", "faq"],
      "description": "Template type"
    },
    "metadata": {
      "type": "object",
      "required": ["name", "description", "category"],
      "properties": {
        "name": { "type": "string" },
        "description": { "type": "string" },
        "category": { "type": "string" },
        "subcategory": { "type": "string" },
        "difficulty": { "enum": ["easy", "medium", "hard"] },
        "icon": { "type": "string" },
        "color": { "type": "string" },
        "tags": { "type": "array", "items": { "type": "string" } },
        "author": { "type": "string" },
        "license": { "type": "string", "default": "MIT" },
        "homepage": { "type": "string", "format": "uri" },
        "newbie": { "type": "boolean" },
        "relatedTemplates": {
          "type": "array",
          "items": { "type": "string" },
          "description": "IDs of related templates/knowledge items"
        },
        "updateFrequency": {
          "enum": ["static", "occasional", "frequent"],
          "description": "How often this content is updated"
        },
        "featured": {
          "type": "boolean",
          "description": "Pin this item to the top of listings"
        },
        "lastUpdated": {
          "type": "string",
          "format": "date-time",
          "description": "ISO 8601 timestamp of last content update"
        }
      }
    },
    "requirements": {
      "type": "object",
      "properties": {
        "skills": { "type": "array", "items": { "type": "string" } },
        "channels": { "type": "array", "items": { "type": "string" } },
        "minVersion": { "type": "string" },
        "maxVersion": { "type": "string" }
      }
    },
    "content": {
      "type": "object",
      "description": "Template content (default language: en)",
      "properties": {
        "soulSnippet": { "type": "string" },
        "heartbeatSnippet": { "type": "string" },
        "examples": { "type": "array", "items": { "type": "string" } },
        "configs": { "type": "object" },
        "automations": { "type": "array" },
        "agents": { "type": "array" },
        "workflow": { "type": "object" },
        "body": { "type": "string", "description": "Markdown body for knowledge items (recipe/tip/faq)" },
        "steps": {
          "type": "array",
          "items": {
            "type": "object",
            "properties": {
              "title": { "type": "string" },
              "description": { "type": "string" },
              "code": { "type": "string" },
              "file": { "type": "string", "description": "Target file path (e.g. SOUL.md)" },
              "language": { "type": "string", "description": "Code language for syntax highlighting" }
            }
          },
          "description": "Step-by-step instructions for recipes"
        },
        "snippet": { "type": "string", "description": "Copyable code/config snippet" },
        "snippetLanguage": { "type": "string", "description": "Language hint for snippet syntax highlighting" },
        "question": { "type": "string", "description": "FAQ question" },
        "answer": { "type": "string", "description": "FAQ answer in markdown" },
        "relatedDoctorChecks": {
          "type": "array",
          "items": { "type": "string" },
          "description": "Doctor check IDs that relate to this FAQ"
        }
      }
    }
  }
}
