{
  "id": "tip-context-pruning",
  "type": "tip",
  "version": "1.0.0",
  "metadata": {
    "name": "上下文裁剪",
    "description": "启用 cache-ttl 模式自动清理过期的工具调用结果，减少不必要的 Token 消耗",
    "category": "optimization",
    "tags": ["context", "pruning", "token", "cost", "cache-ttl"],
    "difficulty": "hard",
    "i18n": {
      "en": {
        "name": "Context Pruning",
        "description": "Enable cache-ttl mode to auto-clean expired tool results and reduce unnecessary token usage"
      }
    }
  },
  "content": {
    "body": "## 什么是上下文裁剪？\n\n在长对话中，AI 的上下文会积累大量工具调用结果（如文件内容、命令输出），这些结果往往只在当时有用。上下文裁剪可以自动移除过期的工具结果，释放宝贵的 token 空间。\n\n## 裁剪模式\n\n| 模式 | 说明 |\n|------|------|\n| **off** | 不裁剪（默认） |\n| **cache-ttl** | 基于 TTL（存活时间）自动裁剪过期内容 |\n\n## 在 ClawDeckX 中配置\n\n前往「配置中心 → 代理」→ 找到「上下文裁剪」区域：\n\n### 核心参数\n\n- **mode** — 选择 `cache-ttl` 启用\n- **ttl** — 内容存活时间（如 \"30m\" 表示 30 分钟后可被裁剪）\n- **keepLastAssistants** — 保留最近 N 条 AI 回复不被裁剪\n\n### 裁剪策略\n\n裁剪分两级，逐步降级：\n\n1. **软裁剪（Soft Trim）** — 当上下文达到 `softTrimRatio`（默认 0.7，即 70%）时触发\n   - 将大段工具结果截断为 headChars + tailChars\n   - 保留开头和结尾，中间用省略号替代\n\n2. **硬清除（Hard Clear）** — 当达到 `hardClearRatio`（默认 0.9，即 90%）时触发\n   - 完全移除过期的工具结果\n   - 用 placeholder 文本替代\n\n### 工具过滤\n\n可以指定只裁剪特定工具的输出：\n- **tools.allow** — 只裁剪这些工具的输出\n- **tools.deny** — 排除这些工具（其输出不会被裁剪）\n\n## 推荐配置\n\n```json\n\"contextPruning\": {\n  \"mode\": \"cache-ttl\",\n  \"ttl\": \"20m\",\n  \"keepLastAssistants\": 3,\n  \"softTrimRatio\": 0.65,\n  \"hardClearRatio\": 0.85\n}\n```\n\n## 配置字段\n\n对应配置路径：`agents.defaults.contextPruning`",
    "editorSection": "agents",
    "statusCheck": {
      "type": "config_field",
      "field": "agents.defaults.contextPruning.mode",
      "okWhen": "truthy",
      "okTemplate": "上下文裁剪已启用",
      "failTemplate": "上下文裁剪未启用，长对话可能浪费大量 Token"
    }
  }
}
