{
  "id": "tip-heartbeat-active-hours",
  "type": "tip",
  "version": "1.0.0",
  "metadata": {
    "name": "心跳活跃时段",
    "description": "设置心跳的活跃时间段，在非工作时间自动停止心跳，节省 API 费用",
    "category": "optimization",
    "tags": ["heartbeat", "active-hours", "schedule", "cost", "timezone"],
    "difficulty": "easy",
    "i18n": {
      "en": {
        "name": "Heartbeat Active Hours",
        "description": "Set active hours for heartbeat — auto-pause during off-hours to save API costs"
      }
    }
  },
  "content": {
    "body": "## 什么是心跳？\n\n心跳（Heartbeat）是 OpenClaw 的定期主动检查机制。AI 助手会按设定的间隔（默认 30 分钟）主动执行一次「检查」，通常用于：\n- 检查新邮件并汇报\n- 执行 HEARTBEAT.md 中定义的周期性任务\n- 定时推送天气/新闻等信息\n\n## 问题：24 小时心跳浪费资源\n\n如果不设置活跃时段，心跳会在凌晨和深夜也持续运行，产生不必要的 API 调用费用。\n\n## 在 ClawDeckX 中配置\n\n前往「配置中心 → 代理」→ 找到「心跳」区域：\n\n1. 在「活跃时段」区域，设置 **开始时间** 和 **结束时间**（24 小时制，如 08:00 - 22:00）\n2. 设置 **时区**（如 Asia/Shanghai、America/New_York）\n3. 活跃时段外，心跳自动暂停\n\n### 其他心跳参数\n\n- **every** — 心跳间隔（如 \"30m\" 表示每 30 分钟一次）\n- **model** — 心跳使用的模型（推荐用便宜的模型，如 gpt-4o-mini）\n- **lightContext** — 启用轻量上下文模式，减少心跳的 token 消耗\n- **directPolicy** — 私聊中的心跳策略：allow（允许）或 block（仅在群组中心跳）\n\n## 推荐配置\n\n**上班族：**\n- activeHours: 08:00 - 23:00\n- every: 30m\n- model: gpt-4o-mini\n\n**夜猫子：**\n- activeHours: 10:00 - 24:00\n- every: 45m\n\n## 配置字段\n\n对应配置路径：`agents.defaults.heartbeat.activeHours`\n\n```json\n\"heartbeat\": {\n  \"every\": \"30m\",\n  \"model\": \"gpt-4o-mini\",\n  \"activeHours\": {\n    \"start\": \"08:00\",\n    \"end\": \"23:00\",\n    \"timezone\": \"Asia/Shanghai\"\n  }\n}\n```",
    "editorSection": "agents",
    "statusCheck": {
      "type": "config_field",
      "field": "agents.defaults.heartbeat.activeHours",
      "okWhen": "truthy",
      "okTemplate": "已设置心跳活跃时段",
      "failTemplate": "未设置活跃时段，心跳 24 小时运行会增加费用"
    }
  }
}
